{"meta":{"version":"3.1","generated":"2025-11-22T15:02:48.089225Z","project":"src"},"comments_text":["!/usr/bin/env python3","Default values (fallback if pyproject.toml is missing)","Validation rules","Extract py-indexer configuration","Validate if rule exists","Check current directory","Check parent directory","Avoid infinite recursion for private attributes","Global configuration instance","Indexes","Name to index mapping","Analysis results","Index file","Index names from imports","Index classes","Index functions","Analyze code","Add class name","Add base classes","Add decorators","Add attributes","Index methods","Check for missing docstring","Analyze class dependencies","Add function name","Add parameters","Check for mutable defaults","Add return type","Check for missing type hints","Parse file again for detailed analysis","Detect SQL injections","Detect hardcoded secrets","Detect global variables","Check logging usage","Check for list","Check for dict","Check for set","Check for list(), dict(), set() calls","Skip special methods","Check parameters (skip self, cls)","Check return type (skip __init__)","Check methods in classes","Get function body lines","Check for logging calls","Find __init__ method","Check if dependencies are passed via __init__ parameters","TODO: Detect classes instantiated inside __init__ (sign of bad DI)","This would require analyzing AST of __init__ body","Project name","Initialize components","Initialize builders","Find Python files","Parse all files","Build indexes","Serialize to files","Get relative path","Add module","Add module location (entire file)","Add module docstring if exists","Add classes","Add class location","Add class docstring","Add class decorators","Add methods","Find parent class index","Add method location","Add method docstring","Add method decorators","Add type hints","Add module-level functions","Add function location","Add function docstring","Add imports","Add import location","Add comments","Add to module level","Ensure output directory exists","Define files and data","Write files","Always write regular version (pretty-printed)","Optionally write minified version","Print statistics","Minified: no indent, no whitespace","Pretty-printed: indent=2","Log with file size","Index project (regular format)","Index project with minified versions","View generated index","Read file","Count lines","Parse AST","Extract module name","Extract module docstring","Initialize parsed file","Extract comments","Extract imports","Extract classes and functions","Only top-level classes","Only top-level functions","Extract bases","Extract docstring","Extract decorators","Extract methods","Line numbers","Extract parameters","Extract return type","Check if async","Find comment","Remove leading # and whitespace","Check existence","Check if directory","Check readability","Check for Python files","If path exists, check if it's a directory and writable","Path doesn't exist - check parent","Create directory if requested","Check msgpack availability","Text dictionary","File paths","Comment data (by location_id)","Format: [location_id, [[text_idx, file_idx, line_number], ...]]","Temporary storage (location_id → list of comments)","Normalize: strip leading/trailing whitespace","Convert temp storage to final format","Count TODO/FIXME/NOTE markers","Docstring data (by location_id)","Format: [location_id, [[text_idx, file_idx, line_start, line_end], ...]]","Temporary storage (location_id → list of docstrings)","File paths (same as INDEX)","Coordinate data (by location_id)","Core registries","Lookup maps (for deduplication)","location_id counter","Structure data","Type data (by location_id)","Normalize path (forward slashes)","Parse arguments","Configure logging","Validate inputs","Parse files","Index files","Display statistics","Build TECH-INDEX","Serialize to file","Display file size","Generate JSON index","Generate compressed JSON","Generate MessagePack index","Compress names array","Custom hash length","Load TECH-INDEX","Validate TECH-INDEX structure","Build TECH-LOCATION","Generate TECH-LOCATION from TECH-INDEX","From GZIP compressed TECH-INDEX","Serialize to JSON string","Write to file","GZIP compressed","Plain JSON","Log file size","Detect if file is GZIP compressed","Read GZIP compressed JSON","Read plain JSON","GZIP magic bytes: 1f 8b","Serialize to MessagePack bytes","Read MessagePack file","Deserialize from MessagePack bytes","Default max file size (1 MB) - can be overridden from config","Check file size BEFORE reading","Truncate if length specified","Check for directory traversal","Check for absolute paths (potential security risk)","Use forward slashes for cross-platform compatibility","Prevent duplicate handlers if logger already configured","Create formatters","File handler - append mode, UTF-8 encoding","Console handler - stdout","If logger has no handlers, set it up with defaults","Update all handlers","Module-level logger for this utils module","Load index","Display metadata","Display sections based on filter","Get base classes if available","Group imports by module","Display top 10 most imported modules","Count items","Code quality statistics"],"modules":[[0,[[0,0,1],[1,0,34],[2,0,48],[3,0,99],[4,0,131],[5,0,155],[6,0,160],[7,0,206],[8,0,215]]],[15,[[0,1,1],[9,1,122],[10,1,127],[11,1,132],[12,1,157],[13,1,160],[14,1,166],[15,1,170],[16,1,174],[17,1,252],[18,1,255],[19,1,259],[20,1,263],[21,1,271],[22,1,275],[23,1,286],[24,1,291],[19,1,294],[25,1,298],[26,1,308],[27,1,320],[28,1,324],[22,1,335],[29,1,352],[30,1,359],[31,1,370],[32,1,381],[33,1,393],[34,1,415],[35,1,419],[36,1,423],[37,1,427],[38,1,460],[39,1,464],[40,1,473],[41,1,511],[42,1,542],[43,1,549],[44,1,581],[45,1,591],[46,1,595],[47,1,596]]],[53,[[0,2,1],[48,2,67],[49,2,70],[50,2,73],[51,2,101],[52,2,109],[53,2,122],[54,2,125],[55,2,142],[56,2,146],[57,2,152],[58,2,160],[59,2,171],[60,2,179],[61,2,187],[62,2,198],[63,2,202],[64,2,204],[65,2,213],[66,2,221],[67,2,232],[68,2,236],[69,2,248],[70,2,256],[71,2,264],[19,2,275],[68,2,279],[72,2,291],[73,2,298],[74,2,305],[75,2,307],[76,2,325],[53,2,328],[77,2,334],[78,2,342],[79,2,344],[80,2,347],[81,2,352],[82,2,373],[83,2,376],[84,2,379],[85,2,465],[86,2,468],[87,2,471]]],[77,[[0,3,1],[88,3,122],[89,3,126],[90,3,129],[91,3,132],[92,3,135],[93,3,138],[94,3,146],[95,3,149],[96,3,152],[97,3,155],[98,3,162],[99,3,215],[100,3,223],[101,3,226],[102,3,229],[103,3,237],[100,3,270],[101,3,273],[104,3,276],[105,3,285],[103,3,288],[106,3,292],[107,3,365],[108,3,368]]],[100,[[0,4,1],[109,4,71],[110,4,76],[111,4,81],[112,4,86],[113,4,128],[114,4,141],[115,4,151],[116,4,199],[6,4,288]]],[116,[[0,5,1],[117,5,53],[118,5,57],[119,5,61],[120,5,62],[121,5,67],[122,5,86],[123,5,221],[124,5,256]]],[131,[[0,6,1],[117,6,52],[118,6,56],[125,6,60],[126,6,61],[127,6,66],[123,6,226]]],[144,[[0,7,1],[128,7,52],[129,7,56]]],[157,[[0,8,1],[130,8,55],[131,8,59],[132,8,63],[133,8,66],[134,8,73],[135,8,113]]],[177,[[0,9,1],[136,9,53],[137,9,56],[138,9,62],[51,9,79],[139,9,88],[140,9,101],[141,9,106],[142,9,116],[143,9,127],[144,9,140],[145,9,175],[146,9,178],[147,9,181],[148,9,184],[149,9,187]]],[196,[[0,10,1],[136,10,49],[137,10,52],[138,10,58],[150,10,67],[151,10,72],[152,10,84],[143,10,89],[144,10,101],[153,10,136],[154,10,139]]],[211,[[0,11,1]]],[220,[[0,12,1],[155,12,77],[156,12,91],[157,12,93],[158,12,98],[159,12,103],[160,12,155],[161,12,159],[162,12,164],[163,12,198]]],[233,[[0,13,1],[164,13,77],[156,13,80],[159,13,86],[165,13,134],[166,13,138]]],[246,[[0,14,1],[167,14,26],[168,14,94],[169,14,218],[170,14,402],[171,14,407],[172,14,444]]],[261,[[0,15,1]]],[269,[[0,16,1],[173,16,60],[174,16,64],[175,16,67],[176,16,76],[177,16,108],[178,16,187],[179,16,192]]],[279,[[0,17,1],[180,17,55],[181,17,62],[182,17,65],[141,17,80],[183,17,151],[184,17,206],[185,17,214],[186,17,229],[187,17,244]]]],"classes":[],"functions":[]}