{
  "meta": {
    "version": "3.1",
    "generated": "2025-11-23T17:28:25.460273Z",
    "project": "cli"
  },
  "comments_text": [
    "Parse arguments",
    "Configure logging",
    "Validate inputs",
    "Find Python files",
    "Parse files",
    "Index files",
    "Display statistics",
    "Build TECH-INDEX",
    "Serialize to file",
    "Display file size",
    "Generate JSON index",
    "Generate compressed JSON",
    "Generate MessagePack index",
    "Compress names array",
    "Custom hash length",
    "!/usr/bin/env python3",
    "Load TECH-INDEX",
    "Validate TECH-INDEX structure",
    "Build TECH-LOCATION",
    "Generate TECH-LOCATION from TECH-INDEX",
    "From GZIP compressed TECH-INDEX"
  ],
  "modules": [
    [
      0,
      [
        [
          15,
          0,
          1
        ],
        [
          0,
          0,
          53
        ],
        [
          1,
          0,
          56
        ],
        [
          2,
          0,
          62
        ],
        [
          3,
          0,
          79
        ],
        [
          4,
          0,
          88
        ],
        [
          5,
          0,
          101
        ],
        [
          6,
          0,
          106
        ],
        [
          7,
          0,
          116
        ],
        [
          8,
          0,
          127
        ],
        [
          9,
          0,
          140
        ],
        [
          10,
          0,
          175
        ],
        [
          11,
          0,
          178
        ],
        [
          12,
          0,
          181
        ],
        [
          13,
          0,
          184
        ],
        [
          14,
          0,
          187
        ]
      ]
    ],
    [
      19,
      [
        [
          15,
          1,
          1
        ],
        [
          0,
          1,
          49
        ],
        [
          1,
          1,
          52
        ],
        [
          2,
          1,
          58
        ],
        [
          16,
          1,
          67
        ],
        [
          17,
          1,
          72
        ],
        [
          18,
          1,
          84
        ],
        [
          8,
          1,
          89
        ],
        [
          9,
          1,
          101
        ],
        [
          19,
          1,
          136
        ],
        [
          20,
          1,
          139
        ]
      ]
    ]
  ],
  "classes": [
    [
      1,
      [
        [
          0,
          0,
          53
        ],
        [
          1,
          0,
          56
        ],
        [
          2,
          0,
          62
        ],
        [
          3,
          0,
          79
        ],
        [
          4,
          0,
          88
        ],
        [
          5,
          0,
          101
        ],
        [
          6,
          0,
          106
        ],
        [
          7,
          0,
          116
        ],
        [
          8,
          0,
          127
        ],
        [
          9,
          0,
          140
        ],
        [
          10,
          0,
          175
        ],
        [
          11,
          0,
          178
        ],
        [
          12,
          0,
          181
        ],
        [
          13,
          0,
          184
        ],
        [
          14,
          0,
          187
        ]
      ]
    ],
    [
      20,
      [
        [
          0,
          1,
          49
        ],
        [
          1,
          1,
          52
        ],
        [
          2,
          1,
          58
        ],
        [
          16,
          1,
          67
        ],
        [
          17,
          1,
          72
        ],
        [
          18,
          1,
          84
        ],
        [
          8,
          1,
          89
        ],
        [
          9,
          1,
          101
        ],
        [
          19,
          1,
          136
        ],
        [
          20,
          1,
          139
        ]
      ]
    ]
  ],
  "functions": [
    [
      3,
      [
        [
          0,
          0,
          53
        ],
        [
          1,
          0,
          56
        ],
        [
          2,
          0,
          62
        ],
        [
          3,
          0,
          79
        ],
        [
          4,
          0,
          88
        ],
        [
          5,
          0,
          101
        ],
        [
          6,
          0,
          106
        ],
        [
          7,
          0,
          116
        ],
        [
          8,
          0,
          127
        ],
        [
          9,
          0,
          140
        ]
      ]
    ],
    [
      4,
      [
        [
          10,
          0,
          175
        ],
        [
          11,
          0,
          178
        ],
        [
          12,
          0,
          181
        ],
        [
          13,
          0,
          184
        ],
        [
          14,
          0,
          187
        ]
      ]
    ],
    [
      22,
      [
        [
          0,
          1,
          49
        ],
        [
          1,
          1,
          52
        ],
        [
          2,
          1,
          58
        ],
        [
          16,
          1,
          67
        ],
        [
          17,
          1,
          72
        ],
        [
          18,
          1,
          84
        ],
        [
          8,
          1,
          89
        ],
        [
          9,
          1,
          101
        ]
      ]
    ],
    [
      23,
      [
        [
          19,
          1,
          136
        ],
        [
          20,
          1,
          139
        ]
      ]
    ]
  ]
}